"Status","Start Time","Stop Time","Duration in ms","Parent Suite","Suite","Sub Suite","Test Class","Test Method","Name","Description"
"passed","Tue Mar 07 04:44:48 GMT 2023","Tue Mar 07 04:44:48 GMT 2023","3","","Labels","","Create new label for authorized user","","Create new label for authorized user",""
"passed","Tue Mar 07 04:44:48 GMT 2023","Tue Mar 07 04:44:48 GMT 2023","3","","Labels","","Delete existing label via api","","Delete existing label via api",""
"broken","Tue Mar 07 04:44:48 GMT 2023","Tue Mar 07 04:44:48 GMT 2023","18","","Labels","","Add label to existing issue for authorized user","","Add label to existing issue for authorized user",""
"passed","Tue Mar 07 04:44:50 GMT 2023","Tue Mar 07 04:44:50 GMT 2023","2","","Milestones","","Create new milestone for authorized user","","Create new milestone for authorized user",""
"passed","Tue Mar 07 04:44:50 GMT 2023","Tue Mar 07 04:44:50 GMT 2023","2","","Milestones","","Close existing milestone for authorized user","","Close existing milestone for authorized user",""
"passed","Tue Mar 07 04:44:47 GMT 2023","Tue Mar 07 04:44:47 GMT 2023","11","","Labels","","Create new label via api","","Create new label via api",""
"passed","Tue Mar 07 04:44:48 GMT 2023","Tue Mar 07 04:44:50 GMT 2023","2006","","Labels","","Delete existing label for authorized user","","Delete existing label for authorized user",""
