"Status","Start Time","Stop Time","Duration in ms","Parent Suite","Suite","Sub Suite","Test Class","Test Method","Name","Description"
"passed","Thu Mar 09 17:10:13 GMT 2023","Thu Mar 09 17:10:13 GMT 2023","3","","Labels","","Create new label for authorized user","","Create new label for authorized user",""
"passed","Thu Mar 09 17:10:12 GMT 2023","Thu Mar 09 17:10:12 GMT 2023","14","","Labels","","Create new label via api","","Create new label via api",""
"passed","Thu Mar 09 17:10:13 GMT 2023","Thu Mar 09 17:10:13 GMT 2023","4","","Labels","","Delete existing label via api","","Delete existing label via api",""
"passed","Tue Mar 07 04:40:32 GMT 2023","Tue Mar 07 04:40:32 GMT 2023","0","","Milestones","","Create new milestone for authorized user","","Create new milestone for authorized user",""
"passed","Tue Mar 07 04:40:32 GMT 2023","Tue Mar 07 04:40:32 GMT 2023","16","","Milestones","","Close existing milestone for authorized user","","Close existing milestone for authorized user",""
"passed","Thu Mar 09 17:10:13 GMT 2023","Thu Mar 09 17:10:14 GMT 2023","1008","","Labels","","Add label to existing issue for authorized user","","Add label to existing issue for authorized user",""
"passed","Thu Mar 09 17:10:14 GMT 2023","Thu Mar 09 17:10:16 GMT 2023","2006","","Labels","","Delete existing label for authorized user","","Delete existing label for authorized user",""
